Power Level,Prefix Name,Suffix Name,Attunement,Description
high,Acid Aura,of the Acid Aura,TRUE,"While this item is equipped, you can use an action to activate this item's aura, which remains active for 1 minute. Upon activation and again at the start of each of your turns, each creature of your choosing within 10 ft. of you takes 1d6 acid damage."
high,Cold Aura,of the Cold Aura,TRUE,"While this item is equipped, you can use an action to activate this item's aura, which remains active for 1 minute. Upon activation and again at the start of each of your turns, each creature of your choosing within 10 ft. of you takes 1d6 cold damage."
high,Fire Aura,of the Fire Aura,TRUE,"While this item is equipped, you can use an action to activate this item's aura, which remains active for 1 minute. Upon activation and again at the start of each of your turns, each creature of your choosing within 10 ft. of you takes 1d6 fire damage."
high,Force Aura,of the Force Aura,TRUE,"While this item is equipped, you can use an action to activate this item's aura, which remains active for 1 minute. Upon activation and again at the start of each of your turns, each creature of your choosing within 10 ft. of you takes 1d6 force damage."
high,Lightning Aura,of the Lightning Aura,TRUE,"While this item is equipped, you can use an action to activate this item's aura, which remains active for 1 minute. Upon activation and again at the start of each of your turns, each creature of your choosing within 10 ft. of you takes 1d6 lightning damage."
high,Necrotic Aura,of the Necrotic Aura,TRUE,"While this item is equipped, you can use an action to activate this item's aura, which remains active for 1 minute. Upon activation and again at the start of each of your turns, each creature of your choosing within 10 ft. of you takes 1d6 necrotic damage."
high,Poison Aura,of the Poison Aura,TRUE,"While this item is equipped, you can use an action to activate this item's aura, which remains active for 1 minute. Upon activation and again at the start of each of your turns, each creature of your choosing within 10 ft. of you takes 1d6 poison damage."
high,Psychic Aura,of the Psychic Aura,TRUE,"While this item is equipped, you can use an action to activate this item's aura, which remains active for 1 minute. Upon activation and again at the start of each of your turns, each creature of your choosing within 10 ft. of you takes 1d6 psychic damage."
high,Radiant Aura,of the Radiant Aura,TRUE,"While this item is equipped, you can use an action to activate this item's aura, which remains active for 1 minute. Upon activation and again at the start of each of your turns, each creature of your choosing within 10 ft. of you takes 1d6 radiant damage."
high,Thunder Aura,of the Thunder Aura,TRUE,"While this item is equipped, you can use an action to activate this item's aura, which remains active for 1 minute. Upon activation and again at the start of each of your turns, each creature of your choosing within 10 ft. of you takes 1d6 thunder damage."
high,Alert,of Alertness,FALSE,"While this item is equipped, it whispers warnings of danger to you, granting you a +1 to initiative rolls and Dexterity saving throws."
high,Bull's,of the Bull,FALSE,"While this item is equipped, you have an exceptionally thick skull. Unarmed strikes made with your head deal bludgeoning damage equal to 1d6 plus your Strength modifier."
high,Soul Stealing,of Soul Stealing,TRUE,"Faint screams can be heard from within this item. While this item is equipped, each time you kill a creature by reducing their hit points to zero you gain temporary hit points equal to that creature's Challenge Rating (CR), rounded up."
high,Enhanced Rest,of Enhanced Rest,FALSE,"While this item is equipped, whenever you roll hit dice to regain hit points, you double the number rolled on each hit die when calculating the total number of hit points regained."
high,Acid Absorbing,of Acid Absorption,FALSE,"While this item is equipped, when you take acid damage, you can use your reaction to negate the acid damage and gain temporary hit points equal to the triggering acid damage. This feature cannot be used again until the next dawn."
high,Cold Absorbing,of Cold Absorption,FALSE,"While this item is equipped, when you take cold damage, you can use your reaction to negate the cold damage and gain temporary hit points equal to the triggering cold damage. This feature cannot be used again until the next dawn."
high,Fire Absorbing,of Fire Absorption,FALSE,"While this item is equipped, when you take fire damage, you can use your reaction to negate the fire damage and gain temporary hit points equal to the triggering fire damage. This feature cannot be used again until the next dawn."
high,Force Absorbing,of Force Absorption,FALSE,"While this item is equipped, when you take force damage, you can use your reaction to negate the force damage and gain temporary hit points equal to the triggering force damage. This feature cannot be used again until the next dawn."
high,Lightning Absorbing,of Lightning Absorption,FALSE,"While this item is equipped, when you take lightning damage, you can use your reaction to negate the lightning damage and gain temporary hit points equal to the triggering lightning damage. This feature cannot be used again until the next dawn."
high,Necrotic Absorbing,of Necrotic Absorption,FALSE,"While this item is equipped, when you take necrotic damage, you can use your reaction to negate the necrotic damage and gain temporary hit points equal to the triggering necrotic damage. This feature cannot be used again until the next dawn."
high,Poison Absorbing,of Poison Absorption,FALSE,"While this item is equipped, when you take poison damage, you can use your reaction to negate the poison damage and gain temporary hit points equal to the triggering poison damage. This feature cannot be used again until the next dawn."
high,Psychic Absorbing,of Psychic Absorption,FALSE,"While this item is equipped, when you take psychic damage, you can use your reaction to negate the psychic damage and gain temporary hit points equal to the triggering psychic damage. This feature cannot be used again until the next dawn."
high,Radiant Absorbing,of Radiant Absorption,FALSE,"While this item is equipped, when you take radiant damage, you can use your reaction to negate the radiant damage and gain temporary hit points equal to the triggering radiant damage. This feature cannot be used again until the next dawn."
high,Thunder Absorbing,of Thunder Absorption,FALSE,"While this item is equipped, when you take thunder damage, you can use your reaction to negate the thunder damage and gain temporary hit points equal to the triggering thunder damage. This feature cannot be used again until the next dawn."
high,Failsafe,of Failsafes,FALSE,"While this item is equipped, if damage would reduce you to 0 hit points, your hit points are immediately restored to their maximum value instead. Once this feature has been used, this item is permanently destroyed."
high,Cinder Queen's,of the Cinder Queen,FALSE,"While this item is equipped, you can use an action to summon a fire elemental in an unoccupied space within 30 ft. of you. The elemental obeys your verbal commands for one hour. Once this feature has been used, this item turns into ash and is permanently destroyed."
high,Sea King's,of the Sea King,FALSE,"While this item is equipped, you can use an action to summon a water elemental in an unoccupied space within 30 ft. of you. The elemental obeys your verbal commands for one hour. Once this feature has been used, this item turns into water and is permanently destroyed."
high,Storm Prince,of the Storm Prince,FALSE,"While this item is equipped, you can use an action to summon an air elemental in an unoccupied space within 30 ft. of you. The elemental obeys your verbal commands for one hour. Once this feature has been used, this item turns into wind and is permanently destroyed."
high,Stone Mother's,of the Stone Mother,FALSE,"While this item is equipped, you can use an action to summon an earth elemental in an unoccupied space within 30 ft. of you. The elemental obeys your verbal commands for one hour. Once this feature has been used, this item turns into dirt and is permanently destroyed."
high,Unchanging,of the Unchanging,TRUE,"This form or appearance of this item cannot be altered. While this item is equipped, you are immune to any spell, curse, or effect that would alter your form, age, maximum hit points, or ability scores."
high,Regenerating,of Regeneration,TRUE,"While this item is equipped, you regain 1 hit point every 5 minutes (12 hit points per hour), up to your hit point maximum."
high,Supernova,of the Supernova,FALSE,"This item radiates an aura of intense power. While this item is equipped, you can use an action to absorb this item's power, permanently destroying the item and doubling all of your ability scores for one minute. After one minute you gain one level of exhaustion."
high,Shielding,of Shielding,TRUE,"While this item is equipped, when you are hit by an attack, you can use a reaction to add +2 to your AC."
high,Quick Step,of Quick Step,FALSE,"While this item is equipped, you can use an action to teleport to an unoccupied space you can see within 60 ft. This feature cannot be used again until the next dawn."
high,Scaled,of Scales,TRUE,"While this item is equipped, your skin is covered in hardened scales. While you aren't wearing armor, your AC equals 12 + your dexterity modifier."
high,Blood Frenzy,of the Blood Frenzy,FALSE,"While this item is equipped, you have advantage on melee attack rolls against any creature that has fewer than half its hit points."
high,Aggressive,of Aggression,FALSE,"While this item is equipped, as a bonus action, you can move up half your speed toward a hostile creature that you can see."
high,Brutish,of the Brute,FALSE,"While this item is equipped, when you hit with a melee weapon attack, your weapon deals one extra die of its damage."
high,Python's,of the Python,FALSE,"While this item is equipped, when you grapple a creature, that creature is also restrained until they break free of the grapple."
high,Pack Mentality,of Pack Mentality,TRUE,"While this item is equipped, you have advantage on an attack roll against a creature if at least one of your allies is within 5 ft of the creature and the ally isn't incapacitated."
high,Steadfast,of Steadfastness,FALSE,"While this item is equipped, you cannot be frightened while you can see or hear an allied creature within 30 feet of you."
high,Shrouded,of Shrouding,TRUE,"While this item is equipped, you are immune to any effect that would sense your emotions or read your thoughts, as well as all divination spells."
high,Seeking,of Seeking,FALSE,"While this item is equipped, if you have even a tiny piece of a creature or an object in your possession, such as a lock of hair or a splinter of wood, this item points towards the most direct route to that creature or object if it is within 1 mile of you."
high,Shadowborn,of the Shadowborn,FALSE,"Shadows seem to cling to this item. While this item is equipped and you are in dim light or darkness, you can take the Hide action as a bonus action."
high,Blood Toll,of the Blood Toll,FALSE,"As an action, you can pay a blood toll to this item, exchanging a portion of your current hit points for a boon. For every 5 hit points given to this item, you gain a +1 bonus on your next attack (bonus applies to the damage roll as well), ability check, or saving throw, up to a maximum of +5."
low,Misty,of the Mist,FALSE,"While this item is equipped, you can see clearly through even the thickest fog, smoke, or mist."
low,Pack Leader's,of the Pack Leader,FALSE,"While this item is equipped, you can understand and be understood by wolves and dogs."
low,Dark,of Darkness,FALSE,"This item is an impossibly dark shade of black. While this item is equipped, any open flame no larger than a torch within 10 ft. of you is extinguished."
low,Wraith's,of the Wraith,FALSE,"This item feels lighter than you expect. While this item is equipped, you do not leave footprints."
low,Harlequin's,of Harlequins,FALSE,"This item is painted with vibrant colors. While this item is equipped, you are an expert juggler."
low,Mockingbird's,of the Mockingbird,FALSE,"This item has images of birds painted on it. While this item is equipped, you can perfectly mimic the voice of any creature you've heard within the last 24 hours."
low,Gambler's,of Gambling,FALSE,"While this item is equipped, you can magically pull a real playing card of your choice from your sleeve at will. Any other cards you've created in this manner disappear once you create a new card."
low,Anchored,of Anchoring,FALSE,This item cannot leave the plane of existence on which it was made.
low,Sturdy,of Sturdiness,FALSE,This item cannot be damaged or destroyed by non-magical means.
low,Weary Traveler's,of the Weary Traveler,FALSE,"This item is sturdy and well worn. While this item is equipped, you always know the direction of the nearest inn or tavern."
low,Miner's,of the Mines,FALSE,"While this item is equipped and you are underground, you know the direction of the nearest path to the surface, if any such path exists."
low,Clear Thinking,of Clear Thoughts,FALSE,"While this item is equipped, you cannot become intoxicated from ingesting alcohol."
low,Drunkard's,of the Drunkard,FALSE,"While this item is equipped, you do not suffer any of the effects of a hangover after a night of drinking. This does not prevent you from becoming intoxicated from drinking alcohol."
low,Pickpocket's,of Pickpocketing,FALSE,"While this item is equipped, you know the amount of currency carried by any creature that you can see within 10 feet of you."
low,Commander's,of the Commander,FALSE,"While this item is equipped, you can choose to make your voice carry up to 500 ft."
low,Bright,of Brightness,FALSE,"A bright light shines from this item, shedding bright light for 20 feet and dim light for an additional 20 feet."
low,Chef's,of the Chef,FALSE,"While this item is equipped, you can magically change the flavor of food and beverages that you prepare."
low,Sage,of the Sage,FALSE,"While this item is equipped, you have an encyclopedic knowledge of a subject chosen by your GM (astronomy, baking, botany, sailing, etc.)."
low,Dreamcatcher,of Dream Catching,FALSE,Outside forces cannot tamper with your dreams while you sleep within 5 ft. of this item.
low,Prophetic,of Prophecy,FALSE,"While this item is equipped, you can use an action to predict what the weather will be like in your location for the next 12 hours."
low,Starfall,of the Stars,FALSE,"This item has elements of a meteorite incorporated into its construction. While this item is equipped, you can use an action to determine the direction of the nearest meteorite (excluding this item) within 1,000 ft."
low,Extinguishing,of Extinguishing,FALSE,"As an action, you can use this item to extinguish a non-magical flame no larger than a campfire within 15 ft. of you."
low,Bartender's,of the Bartender,FALSE,"As an action, you can use this item to create up to 5 pints of ale, 5 cups of wine, or 5 shots of whiskey. This feature cannot be used again until the next dawn."
low,Snack Pack,of Snacks,FALSE,"This item has a hidden compartment filled with nuts, dried fruit, or some other kind of snack. If the compartment is empty, it is magically refilled with more small snacks the next dawn."
low,Rainy Day,of the Rainy Day,FALSE,"While this item is equipped, an invisible force diverts falling rain before it hits you, as if it were an invisible umbrella."
low,Fisherman's Lucky,of the Lucky Fisherman,FALSE,"This item is well worn and smells faintly of fish. While this item is equipped, you have advantage on checks made to catch fish or other sea creatures."
low,Musician's,of the Musician,FALSE,"While this item is equipped, you gain proficiency in one instrument of the GM's choice."
low,Loot Goblin's,of the Loot Goblin,FALSE,"As an action, you can use this item to determine the direction of the nearest piece of art, jewel, or collection of currency worth 500 gp or more within 1000 ft. of you."
low,Lost,of the Lost Kingdom,FALSE,"This item bears the cracked or defaced symbol of an ancient kingdom. While this item is equipped, you have advantage on Intelligence(History) checks made to recall lore about ancient kingdoms or civilizations."
low,Dog Person's,of the Dog Person,FALSE,"While this item is equipped, you have advantage on Wisdom(Animal Handling) checks made to interact with dogs or other canines and disadvantage on Wisdom(Animal Handling) checks to interact with cats."
low,Cat Person's,of the Cat Person,FALSE,"While this item is equipped, you have advantage on Wisdom(Animal Handling) checks made to interact with cats and disadvantage on Wisdom(Animal Handling) checks made to interact with dogs or other canines."
low,Napoleon's,of Napoleon,FALSE,"This item appears to be slightly larger than it actually is. While this item is equipped, illusory magic causes you appear to be 1d6 inches taller."
low,Small,of Small Stature,FALSE,"This item appears to be slightly smaller than it actually is. While this item is equipped, illusory magic causes you appear to be 1d6 inches shorter."
low,Elf Kin,of Elf Kin,FALSE,"While this item is equipped, illusory magic causes your facial features to appear more elvish, including pointed ears."
low,Orc Kin,of Orc Kin,FALSE,"While this item is equipped, illusory magic causes your facial features to appear more orcish, including tusks."
low,Dwarf Kin,of Dwarf Kin,FALSE,"While this item is equipped, illusory magic causes your facial features to appear more dwarvish, including a magnificent beard."
low,Human Kin,of Human Kin,FALSE,"While this item is equipped, illusory magic causes your facial features to appear more human, including rounded ears."
low,Dragon Kin,of Dragon Kin,FALSE,"While this item is equipped, illusory magic causes your facial features to appear more draconic (like a dragonborn), including scales."
low,Demon Kin,of Demon Kin,FALSE,"While this item is equipped, illusory magic causes your facial features to appear more demonic (like a tiefling), including horns."
low,Fey,of the Feywild,FALSE,"This item is covered in intricate carvings of flowers and vines. It glows faintly when it is within 100 ft. of a portal to the Feywild, shedding dim, greenish light for 5 ft."
low,Shadowfell,of Shadowfell,FALSE,"This item is a dull grey, as if all its color had been drained. It glows faintly when it is within 100 ft. of a portal to Shadowfell, shedding dim light for 5 ft."
low,Hipster,of Hipsters,FALSE,"While this item is equipped, you always know the direction of the nearest craft brewery."
low,Elemental Fire,of Elemental Fire,FALSE,"This item is made entirely of harmless flames. Despite its strange construction, the item is solid to the touch and functions like a normal item. It glows faintly when it is within 100 ft. of a portal to the elemental plane of fire, shedding dim light for 5 ft."
low,Elemental Earth,of Elemental Earth,FALSE,"This item is made entirely of solid rock. Despite its strange construction, the item is surprisingly light and functions like a normal item. It glows faintly when it is within 100 ft. of a portal to the elemental plane of earth, shedding dim light for 5 ft."
low,Elemental Air,of Elemental Air,FALSE,"This item is made entirely of swirling air and clouds. Despite its strange construction, the item is solid to the touch and functions like a normal item. It glows faintly when it is within 100 ft. of a portal to the elemental plane of air, shedding dim light for 5 ft."
low,Elemental Water,of Elemental Water,FALSE,"This item is made entirely of water. Despite its strange construction, the item is solid to the touch and functions like a normal item. It glows faintly when it is within 100 ft. of a portal to the elemental plane of water, shedding dim light for 5 ft."
low,Paired,of Pairs,FALSE,"This item is paired with another identical item. While this item is equipped, you always know the direction of the other item in the pair."
low,Elderwood,of the Elderwood,FALSE,"This item is made from an old, dark wood. While this item is equipped, you know the direction of the oldest tree within 10 miles of you."
low,Graceful,of Grace,FALSE,"This item is light and well balanced. While this item is equipped, you take no damage from falling 30 ft. or less."
low,Singer's,of Singing,FALSE,"While this item is equipped, you have a lovely singing voice."
low,Stormborn,of the Stormborn,FALSE,"While this item is equipped, you have a +1 bonus to all skill checks made during thunderstorms."
low,Snowborn,of the Snowborn,FALSE,"While this item is equipped, you have a +1 bonus to all skill checks made while it is snowing."
low,Melancholic,of Melancholy,FALSE,"While this item is equipped, you are overcome by a feeling of melancholy."
low,Weather Vane,of the Weather Vane,FALSE,"Each dawn, this item changes color based on the weather patterns of the upcoming day. Blue for foul/stormy, grey for overcast/neutral, or orange for fair/clear."
low,Bro's,of the Bro,FALSE,"While this item is equipped, people tend to view you as a chill dude and a real bro. You have advantage on checks made to interact or blend in with bros, lads, or chill dudes."
low,Fire Speaker's,of the Fire Speaker,FALSE,"While this item is equipped, you can extinguish an open flame you can see within 15 ft. by using your action to make a successful Charisma(Persuasion) or Charisma(Intimidation) check. The DC is 10 for a tiny fire and goes up by 3 for each size category greater than tiny (DC 13 for small, DC 16 for medium, etc.)."
low,Fated,of Fates,FALSE,"While touching this item, you can use an action to speak the name of one creature. If that creature is alive and on the same plane of existence as you the item briefly glows with a faint blue light. This feature cannot be used again until the next dawn."
low,Aquan,of the Aquan,FALSE,"This item is covered in barnacles and sea shells. While this item is equipped, you can understand and be understood by fish and other aquatic beasts."
low,Swiss Army,of the Swiss Army,FALSE,"This item has several small, foldable tools incorporated into its construction. As a bonus action, you can unfold or fold one of the following tools: fork, knife, spoon, screwdriver, small file, small scissors, corkscrew, or bottle opener."
low,Draconic,of Dragons,FALSE,This item was created by a powerful dragon and is infused with some of its power. This item is made from shed dragon scales and talons and grows slightly warm when within 120 ft. of a dragon.
low,Haggling,of Haggling,FALSE,"While this item is equipped, you have advantage on checks made to haggle or negotiate prices."
low,Packrat,of the Packrat,FALSE,"While this item is equipped, your carrying capacity is doubled."
low,Mountain Ranger's,of the Mountain Ranger,FALSE,"This item is camouflaged to blend in with rocky terrain. While this item is equipped, this camouflage extends to you as well, granting you advantage on Dexterity(Stealth) checks made in mountainous or rocky terrain."
low,Forest Ranger's,of the Forest Ranger,FALSE,"This item is camouflaged to blend in with forest terrain. While this item is equipped, this camouflage extends to you as well, granting you advantage on Dexterity(Stealth) checks made in forest or woodland terrain."
low,Tundra Ranger's,of the Tundra Ranger,FALSE,"This item is camouflaged to blend in with snowy terrain. While this item is equipped, this camouflage extends to you as well, granting you advantage on Dexterity(Stealth) checks made in snowy, icy, or tundra terrain."
low,Coastal Ranger's,of the Coastal Ranger,FALSE,"This item is camouflaged to blend in with coastal terrain. While this item is equipped, this camouflage extends to you as well, granting you advantage on Dexterity(Stealth) checks made in coastal or marine terrain."
low,Swamp Ranger's,of the Swamp Ranger,FALSE,"This item is camouflaged to blend in with swampy terrain. While this item is equipped, this camouflage extends to you as well, granting you advantage on Dexterity(Stealth) checks made in swamp or marsh terrain."
low,Desert Ranger's,of the Desert Ranger,FALSE,"This item is camouflaged to blend in with desert terrain. While this item is equipped, this camouflage extends to you as well, granting you advantage on Dexterity(Stealth) checks made in desert or wasteland terrain."
low,Grassland Ranger's,of the Grassland Ranger,FALSE,"This item is camouflaged to blend in with grassland terrain. While this item is equipped, this camouflage extends to you as well, granting you advantage on Dexterity(Stealth) checks made in grassland or plains terrain."
low,Slippery,of Slipperiness,FALSE,"While this item is equipped, you have advantage on checks made to resist or escape being grappled."
low,Diver's,of Diving,FALSE,"While this item is equipped, the amount of time you can hold your breath for is tripled."
low,Green Thumb,of the Green Thumb,FALSE,"While this item is equipped, you have advantage on checks made to identify, grow, or interact with plants."
low,Wasteland,of the Wastes,FALSE,This item draws you in the direction of the nearest natural source of water within 10 miles.
low,Observant,of Observations,FALSE,"While this item is equipped, you are able to see writing that has been obscured or made invisible."
low,Bound,of the Bound,FALSE,This item cannot be removed from your possession against your will.
low,Graceful,of Gracefulness,FALSE,"While this item is equipped, when you take damage from falling, you can use your reaction to reduce the damage from falling by 1d6."
low,Perfectly Balanced,of Perfect Balance,FALSE,"While this item is equipped, you have advantage on checks or saving throws made to keep your balance."
